{
  "schema_version": "1.0",
  "scenario_id": "scenario_001",
  "scenario_family": "sql_injection",
  "description": "Controlled SQL injection against the AutoShield API search endpoint.",
  "environment": "isolated_docker_lab",
  "execution": {
    "method": "manual",
    "target_allowlist": [
      "autoshield-nginx",
      "autoshield-api",
      "autoshield-postgres"
    ]
  },
  "ground_truth_reference": "evaluation/scenarios/scenario_001_ground_truth.json"
}
